{
  "$schema": "./catalogue.schema.json",
  "schemaVersion": "1.0.0",
  "updatedAt": "2026-10-25",
  "book": {
    "id": "death-and-life",
    "title": "The Death and Life of Great American Cities",
    "author": "Jane Jacobs",
    "originalPublicationYear": 1961
  },
  "editions": [
    {
      "id": "knopf-doubleday-epub-2016",
      "publisher": "Knopf Doubleday Publishing Group",
      "year": 2016,
      "isbn": "9780525432852",
      "description": "Working edition: user-supplied EPUB, Knopf Doubleday Publishing Group, 2016-07-20, ISBN 9780525432852; package metadata also lists source ISBN 9780679741954. Page references follow pagebreak labels embedded in this EPUB, not reader-generated screen numbers. Correspondence with other print editions is not asserted."
    }
  ],
  "chapters": [
    {
      "id": "ch01",
      "number": 1,
      "title": "Introduction",
      "sourceId": "book-contents"
    },
    {
      "id": "ch02",
      "number": 2,
      "title": "The uses of sidewalks: safety",
      "sourceId": "book-contents"
    },
    {
      "id": "ch03",
      "number": 3,
      "title": "The uses of sidewalks: contact",
      "sourceId": "book-contents"
    },
    {
      "id": "ch04",
      "number": 4,
      "title": "The uses of sidewalks: assimilating children",
      "sourceId": "book-contents"
    },
    {
      "id": "ch05",
      "number": 5,
      "title": "The uses of neighborhood parks",
      "sourceId": "book-contents"
    },
    {
      "id": "ch06",
      "number": 6,
      "title": "The uses of city neighborhoods",
      "sourceId": "book-contents"
    },
    {
      "id": "ch07",
      "number": 7,
      "title": "The generators of diversity",
      "sourceId": "book-contents"
    },
    {
      "id": "ch08",
      "number": 8,
      "title": "The need for primary mixed uses",
      "sourceId": "book-contents"
    },
    {
      "id": "ch09",
      "number": 9,
      "title": "The need for small blocks",
      "sourceId": "book-contents"
    },
    {
      "id": "ch10",
      "number": 10,
      "title": "The need for aged buildings",
      "sourceId": "book-contents"
    },
    {
      "id": "ch11",
      "number": 11,
      "title": "The need for concentration",
      "sourceId": "book-contents"
    },
    {
      "id": "ch12",
      "number": 12,
      "title": "Some myths about diversity",
      "sourceId": "book-contents"
    },
    {
      "id": "ch13",
      "number": 13,
      "title": "The self-destruction of diversity",
      "sourceId": "book-contents"
    },
    {
      "id": "ch14",
      "number": 14,
      "title": "The curse of border vacuums",
      "sourceId": "book-contents"
    },
    {
      "id": "ch15",
      "number": 15,
      "title": "Unslumming and slumming",
      "sourceId": "book-contents"
    },
    {
      "id": "ch16",
      "number": 16,
      "title": "Gradual money and cataclysmic money",
      "sourceId": "book-contents"
    },
    {
      "id": "ch17",
      "number": 17,
      "title": "Subsidizing dwellings",
      "sourceId": "book-contents"
    },
    {
      "id": "ch18",
      "number": 18,
      "title": "Erosion of cities or attrition of automobiles",
      "sourceId": "book-contents"
    },
    {
      "id": "ch19",
      "number": 19,
      "title": "Visual order: its limitations and possibilities",
      "sourceId": "book-contents"
    },
    {
      "id": "ch20",
      "number": 20,
      "title": "Salvaging projects",
      "sourceId": "book-contents"
    },
    {
      "id": "ch21",
      "number": 21,
      "title": "Governing and planning districts",
      "sourceId": "book-contents"
    },
    {
      "id": "ch22",
      "number": 22,
      "title": "The kind of problem a city is",
      "sourceId": "book-contents"
    }
  ],
  "sources": [
    {
      "id": "book-contents",
      "title": "Book table of contents — university-hosted scan",
      "url": "https://neu.edu.vn/Resources/Docs/SubDomain/khoamoitruongdothi/2024/jane_jacobs_the_death_and_life_of_great_american.pdf",
      "accessedAt": "2026-10-22",
      "kind": "bibliographic",
      "note": "Chapter numbers and titles checked against the contents on PDF pages 7–8. No book passages or edition-specific page references have been transcribed."
    },
    {
      "id": "hudson-coordinate",
      "title": "Mapcarta / GeoNames — Hudson Street",
      "url": "https://mapcarta.com/34349102",
      "accessedAt": "2026-10-22",
      "kind": "geographic",
      "note": "Representative street point: 40.73945, -74.00541. GeoNames identifier 11001712. This is not a verified Jacobs address or the specific block discussed in a passage."
    },
    {
      "id": "rittenhouse-coordinate",
      "title": "TopoZone — Rittenhouse Square geographic listing",
      "url": "https://www.topozone.com/pennsylvania/philadelphia-pa/park/rittenhouse-square/",
      "accessedAt": "2026-10-22",
      "kind": "geographic",
      "note": "Park waypoint: 39.9492795, -75.1724005; listed with the Philadelphia USGS map area. A representative point, not a park boundary or historically verified observation location."
    },
    {
      "id": "northend-coordinate",
      "title": "Mapcarta / OpenStreetMap — North End",
      "url": "https://mapcarta.com/Boston/North_End",
      "accessedAt": "2026-10-22",
      "kind": "geographic",
      "note": "Neighborhood point: 42.3651, -71.0545. OpenStreetMap node 158809955. Neighborhood extents are not represented by this point."
    },
    {
      "id": "union-coordinate",
      "title": "Wikidata — Union Square (Q527972)",
      "url": "https://www.wikidata.org/wiki/Q527972",
      "accessedAt": "2026-10-22",
      "kind": "geographic",
      "note": "Coordinate statement: 37°47′17″N, 122°24′27″W, converted to decimal degrees. The Wikidata statement has no attached reference; independent geographic verification is pending."
    },
    {
      "id": "morningside-heights-coordinate",
      "title": "Wikipedia — Morningside Heights",
      "url": "https://en.wikipedia.org/wiki/Morningside_Heights",
      "accessedAt": "2026-10-25",
      "kind": "geographic",
      "note": "A representative neighborhood point. The passage concerns the area as a whole, not one institution."
    },
    {
      "id": "west-end-coordinate",
      "title": "Mapcarta / OpenStreetMap — West End",
      "url": "https://mapcarta.com/29409762",
      "accessedAt": "2026-10-25",
      "kind": "geographic",
      "note": "Modern neighborhood point (OSM node 2074102301). Jacobs discusses the neighborhood before demolition; this marker does not reconstruct its former boundaries."
    },
    {
      "id": "chatham-village-coordinate",
      "title": "Mapcarta / OpenStreetMap — Chatham Village",
      "url": "https://mapcarta.com/W464855734",
      "accessedAt": "2026-10-25",
      "kind": "geographic",
      "note": "Representative point for the residential community (OSM way 464855734), not a particular dwelling."
    },
    {
      "id": "back-of-the-yards-coordinate",
      "title": "Mapcarta / OpenStreetMap — Back of the Yards",
      "url": "https://mapcarta.com/22113558",
      "accessedAt": "2026-10-25",
      "kind": "geographic",
      "note": "Representative district point (OSM node 153453085). The point does not define the district’s boundaries in Jacobs’s time."
    },
    {
      "id": "rockefeller-center-coordinate",
      "title": "Mapcarta / OpenStreetMap — Rockefeller Center",
      "url": "https://mapcarta.com/22614096/Map",
      "accessedAt": "2026-10-25",
      "kind": "geographic",
      "note": "Representative point for the complex (OSM node 4236846689), not the exact position of the extra street discussed in the excerpt."
    },
    {
      "id": "carnegie-hall-coordinate",
      "title": "Mapcarta / OpenStreetMap — Carnegie Hall",
      "url": "https://mapcarta.com/22568824",
      "accessedAt": "2026-10-25",
      "kind": "geographic",
      "note": "Representative building point (OSM way 265148502). The excerpt concerns the concert hall and surrounding neighborhood."
    },
    {
      "id": "stuyvesant-town-coordinate",
      "title": "Mapcarta / OpenStreetMap — Stuyvesant Town–Peter Cooper Village",
      "url": "https://mapcarta.com/25010642",
      "accessedAt": "2026-10-25",
      "kind": "geographic",
      "note": "Point within Stuyvesant Town from a source describing the combined Stuyvesant Town–Peter Cooper Village development (OSM way 170294693). Not a building-specific location."
    },
    {
      "id": "eighth-street-coordinate",
      "title": "Mapcarta / OpenStreetMap — 20 West 8th Street",
      "url": "https://mapcarta.com/N2550067177",
      "accessedAt": "2026-10-25",
      "kind": "geographic",
      "note": "Modern address point at 20 West 8th Street (OSM node 2550067177), used only to locate the Greenwich Village street. The current business is not identified as a business in Jacobs’s account."
    },
    {
      "id": "washington-square-park-coordinate",
      "title": "Mapcarta / OpenStreetMap — Washington Square Park",
      "url": "https://mapcarta.com/22632354",
      "accessedAt": "2026-10-25",
      "kind": "geographic",
      "note": "Representative park point (OSM way 22899302). This is the New York park, not Washington Square in Philadelphia."
    },
    {
      "id": "central-park-coordinate",
      "title": "NYC Landmarks Preservation Commission — Central Park",
      "url": "https://archaeology.cityofnewyork.us/collection/map/central-park/borough/manhattan",
      "accessedAt": "2026-10-25",
      "kind": "geographic",
      "note": "Representative park point from the city’s archaeological collection map. The excerpt discusses the park’s eastern edge; this point represents the whole park rather than a particular perimeter facility."
    },
    {
      "id": "oakland-coordinate",
      "title": "Mapcarta / OpenStreetMap — Oakland, Pittsburgh",
      "url": "https://mapcarta.com/Pittsburgh/Oakland",
      "accessedAt": "2026-10-25",